title,description,url,published_date,source,country,language
Bounce legend Big Freedia on going gospel I never heard God doesnt love gay folks. God loves us all,"Adored by Beyoncé and Drake, the New Orleans rapper has returned to her church choir roots with an album that honours queer gospels hidden history. After the death of her partner, she says I need it more than anybodyOn stage at Nashville Pride festival on a sweltering June afternoon, Big Freedia is her usual boisterously commanding self. She invites volunteers and the sign-language interpreter to join her and her dancers in getting down to bounce music, the relentlessly kinetic style of hip-hop for which she has become a figurehead in her native New Orleans. Then she pauses for a brief heart-to-heart with the audience. I dont know if yall know this, but I started in the church, she says.Big Freedias forthcoming album, Pressing Onward, is a gospel record and she is keen to stress that she isnt abandoning her core audience. The gay, gender-fluid rapper and reality TV star exhorts every kind of body to shake it and is unequivocal about her support for all marginalised people her reputation led Beyoncé and Drake to sample her on some of their most successful tracks. This album is for us, she emphasises. It is for people who are LGBTQ and who love God. Continue reading...",https://www.theguardian.com/music/2025/jul/24/bounce-legend-big-freedia-gospel-album-beyonce-god-gay,2025-07-24T16:00:32,The Guardian,UK,en
You be the judge Should my partner stop obsessively cutting costs when we travel?,"Persephone prefers to splash the cash on holiday, whereas Cara likes to travel on a budget  starting with the baggage. You get to weigh up the case Find out how to get a disagreement settled or become a jurorNice accommodation is a big part of a trip, and by cutting corners Cara actually costs us moneyIm a budget babe and a foodie. I want to eat at nice places, not waste money on luggage fees and hotels Continue reading...",https://www.theguardian.com/lifeandstyle/2025/jul/24/you-be-the-judge-should-my-partner-stop-obsessively-cutting-costs-when-we-travel,2025-07-24T07:00:02,The Guardian,UK,en
Country diary A remarkable story of a remarkable plant  Tim Earl,"Stoney Mountain, Isle of Man The lesser twayblade orchid has been giving the islands botanists the runaround for nearly 150 years. Now, suddenly, we have hundredsExcitement ran high when lesser twayblade, a diminutive, twoleafed orchid that normally grows under the cover of heather, was found by the botanists Aline Thomas and Andree Dubbeldam on one of our southern hills. After all, it had not been recorded in the island since 1881, and their Sunday walk close to Snuff the Wind  a former mine  had hardly been charged with expectation. A government ranger was called and the record was made official.That was in 2009. Afterwards, three further records were found, but then the shy little plant slipped back into hiding. Continue reading...",https://www.theguardian.com/environment/2025/jul/25/country-diary-a-remarkable-story-of-a-remarkable-plant,2025-07-25T04:30:48,The Guardian,UK,en
"No more meltdowns, mess or madness! 20 simple tips for surviving long family journeys","Feeling frazzled at the thought of hours travelling by car, train or ferry? Try these easy, expert-backed ways to keep kids and adults calm, fed and smiling 17 tips for keeping kids entertained over summer some are even freeThe phrases Are we there yet? and Im hungry provide a soundtrack whenever I travel with my six- and three-year-old daughters. No matter how far weve gone, theres a constant stream of demands for snacks, games, entertainment, stories, songs  the list goes on.Every summer, we travel to the Lake District, a seven-hour drive. And we regularly holiday in France, which involves long train, ferry and car journeys, so my husband and I have become skilled at managing these. Continue reading...",https://www.theguardian.com/thefilter/2025/jul/24/how-to-survive-long-family-journeys-car-train,2025-07-24T14:00:17,The Guardian,UK,en
The only thing that gets me out of my tent the camping essentials you need and what you dont,"From foam wash to hammocks, these are the non-negotiables seasoned campers swear by  and the kit theyd happily skip The best camping mattresses for every type of adventure, testedPacking for a camping trip isnt easy, especially if youre not an experienced adventurer. Newbie campers often overpack while simultaneously leaving more useful items at home.As a lifelong city dweller, my lack of knowhow has been exposed on trips with my camping-savvy family in the US. It turns out that House of Leaves by Mark Z Danielewski and a medium-sized Bluetooth speaker arent must-haves on a four-day wilderness hike. Who knew? An extra water bottle would have been a better use of that space, something I learned through a series of hardships. Continue reading...",https://www.theguardian.com/thefilter/2025/jul/23/camping-essentials-uk,2025-07-23T14:11:07,The Guardian,UK,en
"The best kettles to save energy and speed up your cuppa, tested","Not all electric kettles are created equal. We boiled litres of water to find the best, from hard-water heroes to vintage-style, repairable and wi-fi connected models The best air fryers, tried and tested for crisp and crunchDespite the march of progress, the humble kettle remains a kitchen staple. Its what we turn to in times of strife, when spirits are flagging, or to start our day. And when a visitor calls, one of the first things we do is put the kettle on.While many small appliances have evolved beyond their original form, the kettles basic principles remain largely unchanged. Water goes in and heats up until a thermostat switches it off the water then pours out, and we enjoy a cuppa. However, the technology that goes into a kettle has been slowly improving better insulation to keep water hotter for longer and reduce reboils different temperature settings to suit every drink from green tea to herbal brews and more features such as filters and concealed elements to keep scale out of our cups.Best kettle overall Bosch Sky kettle76 at AmazonBest budget kettle Kenwood Ripple kettle29.99 at KenwoodThe forever kettle Dualit Classic kettle140 at CurrysBest quiet kettleZwilling Enfinigy Pro kettle139 at ZwillingBest budget variable temperature kettle Lakeland Digital double-walled kettle44.99 at Lakeland Continue reading...",https://www.theguardian.com/thefilter/2025/jul/22/best-electric-kettles-uk,2025-07-22T14:17:25,The Guardian,UK,en
Its the low-key moments that stay with us the secret to happy summer holidays with the kids,"Affordable family fun wedding gift ideas couples will actually want and the best gins, tested Dont get the Filter delivered to your inbox? Sign up hereOn a walk with my children, now in their mid-20s, I asked them what they remembered best from their school summer holidays. I expected to hear about the fiesta we witnessed in the heat of Tarifa, Spain, or be berated for the time I booked early flights to Crete, leaving us sitting in the waiting room of a resort from 4am until check-in time.I was greatly amused and slightly relieved, then, to hear my son say Our summer books  that time we collected all those random things, took them home and stuck them into a book. He was delighted that weve kept them.The best wedding gifts in the UK 13 ideas that couples will actually wantThe best moisturising lip balms to hydrate and protect your lipsThe best gins for GTs, martinis and negronis, from our taste test of 50Unbelievably terrible the best and worst supermarket vanilla ice-cream, tested and rated Continue reading...",https://www.theguardian.com/thefilter/2025/jul/18/secret-to-happy-summer-holidays-with-kids,2025-07-21T14:00:35,The Guardian,UK,en
Benjamina Ebuehis recipe for strawberry and custard doughnuts  The sweet spot,"Prefer jam or custard in your doughnut? Theres no reason not to have bothI dont make doughnuts very often, but few things are better than the first bite of a freshly fried, pillowy-soft one, sugar-coated lips and all. When it comes to fillings, custard just about beats jam for me, but whos to say you cant have both? So, to satisfy everyone, Ive filled these doughnuts generously with a thick vanilla custard and a speedy strawberry jam. Continue reading...",https://www.theguardian.com/food/2025/jul/25/strawberry-and-custard-doughnut-recipe-benjamina-ebuehi,2025-07-25T05:00:50,The Guardian,UK,en
Theyre great outdoors wines to drink with a barbecue  Hannah Crosbie on drinks,"When it comes to choosing a wine to serve with grilled meat or veg, it pays to think outside the boxIn one section of my first book, Corker A Deeply Unserious Wine Book, I sought to address the single-biggest DM slide I get every summer what wines to bring to a barbecue. And the reason this is my most common request is pretty simple where I live, in London, being invited to a barbecue means you have a friend with a garden, whereas most of us are concertinaed into blocks of flats and house shares.The prospect of spending a hot afternoon outdoors and with a glass of something delicious is far more delightful than the idea of spending it in my sweaty room surrounded by black clothing an excellent heat-insulating technique, by the way, especially if it involves an actual garden and generous pals. Thats an occasion to which you want to bring a bottle of something good. Continue reading...",https://www.theguardian.com/food/2025/jul/24/wines-to-drink-with-a-barbecue-hannah-crosbie,2025-07-24T12:00:15,The Guardian,UK,en
"Rachel Roddys rice salad with red peppers, celery, herbs and egg  recipe","The secret to a really good rice salad is temperature, herbs, good protein and to make sure its studded with flavourful vegetables  transparent bowl optionalA few weeks ago, when the weather turned boiling and the tarmac became soft, I made a bad rice salad. The principal reason for this was the overcooked rice, which was my fault for three reasons I was using a brand I have never used before and didnt read the packet I forgot to set the kitchen timer and I ignored my instinct to tip it out dog? Cake? Compost? Bin? and start again. To my overcooked rice I added not-tasty tomatoes, tough minced parsley, extra-virgin olive oil, a bit too much vinegar, olives, capers and hard-boiled eggs I also added an expensive tin of tuna, which did a brilliant job of making the whole thing taste better, although still not good. Everyone agreed that it was a depressing dinner, then we went out for ice-cream.The good thing about making a bad rice salad is the need to redeem and reassure myself that I am capable of making not only a good one, but a great one, though I do appreciate that todays first paragraph might make you doubt this. A good rice salad begins with well-cooked long-grain rice and involves a good balance of four vegetable elements raw tomatoes, red pepper, cucumber, celery, say, cooked beans, courgettes, peas, sweetcorn, vegetables preserved in oil peppers, mushrooms, artichoke hearts, aubergine, and pickled or salted vegetables dill pickles, olives, capers, caper berries. There should also be some form of protein, whether thats tuna, cheese, tofu, salami or wurstel possibly involve tender herbs be dressed with oil and a little vinegar and always be finished with egg slices, wedges or chopped  you decide. Continue reading...",https://www.theguardian.com/food/2025/jul/24/rice-salad-red-peppers-celery-herbs-egg-recipe-rachel-roddy,2025-07-24T05:00:02,The Guardian,UK,en
Turn a glut of courgettes into a moreish crunchy snack for pizza night,"Scarpaccia is a crunchy polenta flatbread that makes clever use of seasonal courgettes and other summery toppingsAnyone who has ever grown courgettes will know that, come peak season, you have to get inventive with the abundance and come up with new ways to use them before they turn to marrows or perish and melt back into the soil. One fabulous way to cook up a glut is scarpaccia, an Italian classic thats similar to farinata and a distant cousin of pizza. Thinly sliced courgettes are degorged by tossing them in sea salt to extract their juices, then, true to Italian thrift, the flavourful liquid is used to make a batter thats then reunited with the courgettes before baking into a thin, crisp slice. Continue reading...",https://www.theguardian.com/food/2025/jul/23/turn-glut-of-courgettes-into-moreish-crunchy-snack-scarpaccia-pizza-zero-waste-cooking,2025-07-23T12:00:29,The Guardian,UK,en
"If I switch it off, my girlfriend might think Im cheating inside the rise of couples location sharing","Many apps like Find My allow us to follow our loved ones at all times. But just because we can, does it mean we should?When Alan and his partner got together, they were both in failing marriages. If location tracking had been an option for our ex-spouses in those days, things would have been rather different, he says. Alan, from north Oxfordshire, is still a fan of location sharing, despite the fact it would have once thwarted his romantic indiscretions. Im sure we would have still ended up together, but navigating the clandestine meetings would have been trickier.The ability to share your location on your mobile phone has become a common way to keep tabs on friends, family and romantic partners. For some, it has become the signifier of a serious relationship last year, the New York Times called location sharing the final frontier in digital expressions of coupledom and likened it to the Instagram hard launch effectively announcing that youre in a relationship by posting a photo of your partner for the first time. Others location-share on a whim and find themselves able to track the whereabouts of people they havent seen in person for years. Continue reading...",https://www.theguardian.com/lifeandstyle/2025/jul/24/inside-the-rise-of-couple-location-sharing,2025-07-24T04:00:04,The Guardian,UK,en
"After 15 years of premature ejaculation and erectile dysfunction, will I ever satisfy my wife?","We saved ourselves for marriage  but our sex life began with disaster. Now she has lost all interest, and couples counselling doesnt helpI am a 48-year-old man. Both my wife and I come from a conservative background we believe that sex before marriage is a sin and saved ourselves until we got married in our early 30s. Before getting married, I masturbated but never had any real sex. Our first night turned out to be a disaster. I couldnt get an erection. However, as the days passed, we managed to have sex but not to my wifes satisfaction, because I finished within 30 seconds of penetration. I think I suffer from both erectile dysfunction ED and premature ejaculation PE. My ED is not consistent  I have been prescribed Viagra and use it sometimes  but my PE continues, and is taking a toll on us. My wife is uninterested in sex because she doesnt get anything out of it. It has been about 15 years now and we have two kids but our sex life has not improved. I tried couples counselling but that was more about building a bond between us which I believe is not an issue as we love each other and cant think about being with someone else. The only missing piece in our life is satisfying sex. I would do anything to satisfy my wife but I am feeling helpless. Pamela Stephenson Connolly is a US-based psychotherapist who specialises in treating sexual disorders.If you would like advice from Pamela on sexual matters, send us a brief description of your concerns to private.livestheguardian.com please dont send attachments. Each week, Pamela chooses one problem to answer, which will be published online. She regrets that she cannot enter into personal correspondence. Submissions are subject to our terms and conditions. Continue reading...",https://www.theguardian.com/lifeandstyle/2025/jul/22/after-15-years-of-premature-ejaculation-and-erectile-dysfunction-will-i-ever-satisfy-my-wife,2025-07-22T07:00:47,The Guardian,UK,en
Leftists are determined to date each other - and not settle for liberals Politics are the new religion,"Progressives are seeking ideologically aligned matches as hot commie summer heats up, but the apps arent helpingZohran Mamdani gave Hinge an unofficial boost last month when the New York mayoral candidate revealed that he met his wife, Rama Duwaji, through swiping. There is still hope on those dating apps, he said on the Bulwark podcast a week before his stunning victory in the Democratic primary. The tidbit spread over social media, cementing the 33-year-old democratic socialists status as a millennial everyman. A subsequent Cosmopolitan headline read Zohran Mamdani could make history as the first NYC mayor to meet his wife on Hinge.Representatives for Hinge would not comment, but plenty of eligible New Yorkers did, claiming they would redownload the app due to Mamdanis success, in spite of their dating fatigue. Now Im clocking in like its a full-time job, one user posted on TikTok. If he can find love on that app maybe I can, another wrote in a caption. Continue reading...",https://www.theguardian.com/lifeandstyle/2025/jul/21/dating-apps-politics-liberal-progressive,2025-07-21T11:00:16,The Guardian,UK,en
The kindness of strangers I was five years old when a woman Ill never know gave me an extravagant doll,"As a child of refugees, I rarely enjoyed the thrill of a new toy. She must have noticed the longing in my eyesRead more in the kindness of strangers seriesWhen I was very young, my family and I emigrated from Albania to Melbourne. As a child of refugees settling in Australia after the second world war, I experienced the searing poverty that myriads of displaced people dealt with as they tried to rebuild lives in far away, unfamiliar places. As a result, my brothers and sisters and I very rarely enjoyed the magic and thrill that come when a child gets a new toy.One day  I must have been no more than five  I was wandering through the local town hall with my mother. Some sort of fair was in full swing and I happened upon a table where, for a mere penny, I could try my luck to win a doll. I didnt have a penny, but I did have a fervent wish to have a doll  particularly the beautiful one with the gloriously extravagant light blue dress! Continue reading...",https://www.theguardian.com/lifeandstyle/2025/jul/21/the-kindness-of-strangers-i-was-five-years-old-when-a-woman-ill-never-know-gave-me-an-extravagant-doll,2025-07-20T15:00:54,The Guardian,UK,en
What to do if your TfL Oyster or Zip card is lost or stolen,"From how to cancel it and the effect on the balance, there are steps you should consider takingOyster cards revolutionised travel across London, making it easier and faster to get across the capital, and despite the uptick in journeys now made with contactless payments, they are still used by many to get around. They are easy to misplace, however. If yours is lost, damaged or stolen, here are some tips to get you back on track.Check whether your card is registered to a Transport for London TfL account. If you lose an unregistered card, you cant get a refund or replacement, and will lose any pay-as-you-go credit.For a registered card, sign in to your TfL account and report it missing, stolen or faulty. You can also report a lost, stolen or damaged Oyster photocard, including the five to 10, 11-15 or 16 zip cards, 18 student, apprentice, 60 and veterans Oyster photocard, by logging in to your web account. This will cancel the cards.Order a replacement card online or buy one at an Oyster Ticket Stop, which you can find in many newsagents or corner shops around London. It costs 7 for a new Oystercard and 11 to replace a photocard, plus postage. Your pay-as-you-go balance will transfer to your new card as long as youre registered, as will a travelcard or bus and tram pass if you have at least five days travel remaining. If the card is for someone under 18, a parent or guardian must apply on their behalf.Create an account if you havent already and connect it to your Oyster card. Youll already have an account if you buy a Zip card, 18 student, apprentice, 60 or veterans Oyster photocards.Transfer your account to your new card by confirming a security question and answer on your TfL account, or providing details of a journey you made with the Oyster card in the last eight weeks. You can do this by selecting add new Oyster card and entering the card number, or under the transfer my products to another Oyster card on your TfL account after youve reported it missing. If the card is for someone under 18, a parent or guardian will have to do this for them.If you get discounted travel, such as with a railcard, you will need to have the discount added to your replacement card. You can do this by asking a member of staff at a station to connect them, so will need your railcard handy.Keep your Oyster card in a secure place, ideally not with other cards, so if you lose one, you dont lose them all. Continue reading...",https://www.theguardian.com/money/2025/jul/23/tfl-oyster-zip-card-lost-stolen-cancel-balance,2025-07-23T06:00:44,The Guardian,UK,en
UK airport parking how to drive down the cost on your summer holiday,From penalties for overstays and delayed flights to the price of meet and greet versus long or short stayHow much airport parking will cost you depends on several factors  when you book how close to the airport you want to be how you book how long your vehicle will stay in the car park and which airport you are flying from. Continue reading...,https://www.theguardian.com/money/2025/jul/23/uk-airport-parking-cost-summer-holiday-flights,2025-07-23T07:00:46,The Guardian,UK,en
Why does British Gas keep playing dumb over my faulty smart meter?,"It wont relay readings, and I now fear an estimated bill I may be unable to challengeIm one of millions whose smart meters have gone dumb and stopped relaying readings to the supplier.British Gas cancelled the first appointment to fix it and failed to show for the second. Theyve since fallen silent. Its now been five months and I am concerned that, at some point, I will be getting an estimated bill that I will be unable to challenge. Continue reading...",https://www.theguardian.com/money/2025/jul/22/british-gas-faulty-smart-meter-bill,2025-07-22T07:00:48,The Guardian,UK,en
Rental fraud the Facebook and Gumtree scam targeting desperate tenants,"Posing as a landlord, fraudsters post adverts for affordable properties to lure victims into parting with deposits upfrontYoure desperately hunting for somewhere to live and scouring rental sites. The odds are stacked against you. Rents are high everywhere  in London tenants are paying almost 1,000 for a shoe cupboard with a bed  and living rooms have gone from a regular commodity to a luxury. But matters are made worse by scammers.Young people now account for three-quarters of rental fraud, according to data from the National Fraud Intelligence Bureau NFIB. Last year alone almost 9m was lost across about 5,000 reported cases.Do not pay any deposit upfront without seeing a property, no matter how desperate you are to find a home.Make sure you go to see any property before you commit to renting.Gumtree advises Always ask to see proof of ownership, or the landlords right to let, and ensure a tenancy agreement is in place before paying deposits or holding fees.Stand your ground if something seems fishy, it probably is.On social media, or listing websites, check when the landlords profile was created. How long have they been active? Do they seem to be advertising multiple properties with similar messages? What comes up when you search their name?If a landlord is claiming to be part of the NRLA, you can check whether their accreditation is legitimate here.Report fraudulent accounts to Facebook and Gumtree. Continue reading...",https://www.theguardian.com/money/2025/jul/20/rental-fraud-facebook-gumtree-scam-landlord-deposits,2025-07-20T07:00:42,The Guardian,UK,en
"Horrendous blisters Retired UK banker, 65, attempts to run 200 marathons in 200 days","Steve James, from Devon, hits halfway mark in circuit of Great Britains coast as scientists monitor impact of extreme featThe first fortnight was tough  terrible blisters, a flare of gout that needed a visit to AE and the rapid realisation that running 200 marathons in 200 days around the coast of Great Britain would not be a walk in the park.But Steve James, a 65-year-old retired banker from Devon, has found his feet, and on Thursday reached the halfway mark  an average of 100 marathons in 100 days. Continue reading...",https://www.theguardian.com/lifeandstyle/2025/jul/24/retired-uk-banker-run-200-marathons-200-days-coastline,2025-07-24T07:35:21,The Guardian,UK,en
Wait  can you get a hernia from wearing tight pants?,"Actor and singer Suki Waterhouse shared why shed been absent from X a hernia. Is it possible? We asked expertsOn 14 July, actor and singer Suki Waterhouse shared a tweet explaining her recent absence from X suki you never tweet anymore have you ever considered I wore pants so tight 6 months ago it caused a hernia  Ive been too scared to tell you.She followed up with two pictures one shows her wearing what are presumably the offending pants, and the other shows her in a hospital bed, hooked up to an IV. There is also a vape resting on her hospital gown. Thats not relevant to this story, just a fun detail. Continue reading...",https://www.theguardian.com/wellness/2025/jul/24/can-tight-pants-cause-hernia,2025-07-24T16:00:33,The Guardian,UK,en
